{
  "$schema": "visual-qa-receipt.schema.json",
  "schema_id": "codex.ui-visual-qa-receipt/v1",
  "screen_revision_id": "UI-DATA-001.recovery.all.ru.graphite@r5",
  "anchor_id": "web-768",
  "contract_sha256": "47ba87fa55655b592c90ca89880af7136d65ed91c75816ff26eebca98744cf9e",
  "generated_by": {
    "script": "assemble_visual_qa_receipt.py",
    "version": "2.0.0",
    "command": "assemble_visual_qa_receipt.py <paths-redacted>"
  },
  "evidence_inputs": {
    "contract": {
      "path": "/Users/daniildegtyarev/Projects/Custometry/.codex/delivery/ui-design-programs/custometry-v2/artifacts/g4-r5/family-data-shell-workspace-baseline/states/recovery/screen-contract.json",
      "sha256": "47ba87fa55655b592c90ca89880af7136d65ed91c75816ff26eebca98744cf9e"
    },
    "baseline": {
      "path": "/Users/daniildegtyarev/Projects/Custometry/.codex/delivery/ui-design-programs/custometry-v2/artifacts/g0-r5/platform-ui-baseline.json",
      "sha256": "ec3108e8d23cf4dd59f217766082ef938dda83245aa46dcc43968c64a8f2bc7c"
    },
    "applicability_manifest": {
      "path": "/Users/daniildegtyarev/Projects/Custometry/.codex/delivery/ui-design-programs/custometry-v2/evidence/family.data.shell-workspace.baseline-r5/states/recovery/standard-applicability.json",
      "sha256": "c32a69e7f441f11fb8329287ea237a7387cc360f7164a45c1c9e326693f36447"
    },
    "reference_geometry": {
      "path": "/Users/daniildegtyarev/Projects/Custometry/.codex/delivery/ui-design-programs/custometry-v2/evidence/family.data.shell-workspace.baseline-r5/states/recovery/web-768/reference-geometry.json",
      "sha256": "429ae90f17d5579d5afce5986a3d2e72fb5166b3875dc12915414004a89d18e3"
    },
    "implementation_geometry": {
      "path": "/Users/daniildegtyarev/Projects/Custometry/.codex/delivery/ui-design-programs/custometry-v2/evidence/family.data.shell-workspace.baseline-r5/states/recovery/web-768/implementation-geometry.json",
      "sha256": "6651c19014b22e7d60730a7311797dd572f77850d902ca9f70eb4f43ccf5fc36"
    },
    "raster": {
      "path": "/Users/daniildegtyarev/Projects/Custometry/.codex/delivery/ui-design-programs/custometry-v2/evidence/family.data.shell-workspace.baseline-r5/states/recovery/web-768/raster-diff.json",
      "sha256": "f81dac2d0e825d954cfd61a7236afa9673d768a04d51b4bc7a6751ef4cb99092"
    }
  },
  "proof_scope": {
    "reference_capture_profile": "visual_authority_reference",
    "implementation_capture_profile": "screen_implementation",
    "reference_target_screen_checks_applied": false,
    "implementation_target_screen_checks_applied": true
  },
  "environment": {
    "browser": "chromium/150.0.7871.187",
    "viewport": {
      "width": 768,
      "height": 1024
    },
    "device_scale_factor": 1,
    "locale": "ru",
    "theme": "graphite",
    "font_bundle_sha256": "d6bd0b01ee22a7e69c46e1e114c3fef614b9186ab5e03720defa3feaec2d35f6",
    "fixture_sha256": "06ec2c541893b9ea5b8a6cba295fc76fc3230270aa4ba22d9fa068dfedba6c07"
  },
  "captures": {
    "reference_sha256": "4ad7a441b6fd84cbad721f97f4fed647ed5a35543df6f63a7ebcdaab26a8eae8",
    "implementation_sha256": "f93381089508b39d807a1c4ed1ebc8cf1ba94d2e2595a399e27692220b9bf09f"
  },
  "comparison": {
    "purpose": "visual_language_conformance",
    "reference_logical_artifact_id": "custometry-pilot-v3-metadata-ru",
    "implementation_logical_artifact_id": "UI-DATA-001.recovery.all.ru.graphite@r5",
    "visual_authority_ref": ".codex/delivery/ui-design-programs/custometry-v2/evidence/pilot-candidate-v3-metadata/ru/source.html",
    "visual_authority_sha256": "b54b8b77d677d57869b0065dbe3aa005f13070297dface19ba98938f50d83700",
    "reference_render_provenance_sha256": "cc5098ac8882e0fcc6fea5fa44838d85eeea28c11aefa369ea20521eab72fa76",
    "implementation_render_provenance_sha256": "5fe86a7a101f1e72e96c7c3fc0c00360effda02121bdb9a7e74ab6086afaa063",
    "reference_source_artifact_ref": ".codex/delivery/ui-design-programs/custometry-v2/evidence/pilot-candidate-v3-metadata/ru/source.html",
    "reference_source_artifact_sha256": "b54b8b77d677d57869b0065dbe3aa005f13070297dface19ba98938f50d83700",
    "implementation_source_artifact_ref": ".codex/delivery/ui-design-programs/custometry-v2/artifacts/g4-r5/family-data-shell-workspace-baseline/states/recovery/screen.html",
    "implementation_source_artifact_sha256": "f99ff8ee9bea3d7689f75904b9aff31a2aebd15fb25318367c9668cae7c291a6",
    "provenance_passed": true,
    "proves_fidelity": false,
    "blockers": []
  },
  "interaction": {
    "visible_action_ids": [
      "UI-DATA-001.connection.manage",
      "UI-DATA-001.connection.secret.rotate",
      "journey.data-to-trusted-result.1"
    ],
    "observed_outcomes": [
      {
        "action_id": "UI-DATA-001.connection.manage",
        "outcome": "Управление подключением открыто в fixture",
        "expected_outcome": "Connection Manage completes or the next contract-bound surface opens",
        "assertion_kind": "dom",
        "activation": "keyboard_or_native_form",
        "passed": true,
        "error": null
      },
      {
        "action_id": "UI-DATA-001.connection.secret.rotate",
        "outcome": "Ротация секрета подготовлена без внешней записи",
        "expected_outcome": "Connection Secret Rotate completes or the next contract-bound surface opens",
        "assertion_kind": "dom",
        "activation": "keyboard_or_native_form",
        "passed": true,
        "error": null
      },
      {
        "action_id": "journey.data-to-trusted-result.1",
        "outcome": "Переход к качеству данных готов",
        "expected_outcome": "Continue data to trusted result completes or the next contract-bound surface opens",
        "assertion_kind": "dom",
        "activation": "keyboard_or_native_form",
        "passed": true,
        "error": null
      }
    ],
    "unresolved_visible_actions": [],
    "unexpected_file_urls": [],
    "required_checks": [
      {
        "check_id": "keyboard_activation",
        "passed": true
      },
      {
        "check_id": "focus_visibility",
        "passed": true
      },
      {
        "check_id": "tab_radio_behavior",
        "passed": true
      },
      {
        "check_id": "menus",
        "passed": true
      },
      {
        "check_id": "toggles",
        "passed": true
      },
      {
        "check_id": "refresh_feedback",
        "passed": true
      },
      {
        "check_id": "state_transitions",
        "passed": true
      },
      {
        "check_id": "no_unresolved_file_navigation",
        "passed": true
      },
      {
        "check_id": "no_console_errors",
        "passed": true
      },
      {
        "check_id": "no_request_failures",
        "passed": true
      },
      {
        "check_id": "no_page_horizontal_overflow",
        "passed": true
      }
    ],
    "passed": true
  },
  "geometry": [
    {
      "region_id": "shell.application",
      "comparison_scope": "implementation_contract_only",
      "reference": null,
      "implementation": {
        "x": 0,
        "y": 0,
        "width": 768,
        "height": 1024
      },
      "delta": null,
      "allowed_delta_px": null,
      "passed": true
    },
    {
      "region_id": "shell.page-header",
      "comparison_scope": "implementation_contract_only",
      "reference": null,
      "implementation": {
        "x": 54,
        "y": 0,
        "width": 714,
        "height": 97.547
      },
      "delta": null,
      "allowed_delta_px": null,
      "passed": true
    },
    {
      "region_id": "shell.main-content",
      "comparison_scope": "implementation_contract_only",
      "reference": null,
      "implementation": {
        "x": 54,
        "y": 97.547,
        "width": 714,
        "height": 634.484
      },
      "delta": null,
      "allowed_delta_px": null,
      "passed": true
    },
    {
      "region_id": "UI-DATA-001.content",
      "comparison_scope": "implementation_contract_only",
      "reference": null,
      "implementation": {
        "x": 66,
        "y": 109.547,
        "width": 690,
        "height": 610.484
      },
      "delta": null,
      "allowed_delta_px": null,
      "passed": true
    }
  ],
  "standard_conformance": {
    "standard_revision_id": "custometry.pilot-standard.v3.metadata.r5",
    "clause_inventory_sha256": "f2ca158c083c0d225d8fc25dd87226787fe20863e4e56f7e5b99fb2d3574c1de",
    "applicability_manifest_sha256": "38e98b92ec7f3dfc610fc184ed61c8688b7eb550c4955dd00e982eed9ebbb824",
    "rows": [
      {
        "clause_id": "standard.border.border-color.113f1c240f04",
        "application_id": null,
        "property": "border-color",
        "expected": "rgb(48, 49, 54)",
        "observed": null,
        "tolerance": 0,
        "disposition": "source_backed_not_applicable",
        "exception_ref": null,
        "result": "passed"
      },
      {
        "clause_id": "standard.border.border-color.32e1f263db9b",
        "application_id": null,
        "property": "border-color",
        "expected": "rgb(139, 140, 147)",
        "observed": null,
        "tolerance": 0,
        "disposition": "source_backed_not_applicable",
        "exception_ref": null,
        "result": "passed"
      },
      {
        "clause_id": "standard.border.border-color.33cdc578907b",
        "application_id": null,
        "property": "border-color",
        "expected": "rgb(255, 255, 255)",
        "observed": null,
        "tolerance": 0,
        "disposition": "source_backed_not_applicable",
        "exception_ref": null,
        "result": "passed"
      },
      {
        "clause_id": "standard.border.border-color.6021d9ecb051",
        "application_id": null,
        "property": "border-color",
        "expected": "rgb(201, 203, 208)",
        "observed": null,
        "tolerance": 0,
        "disposition": "source_backed_not_applicable",
        "exception_ref": null,
        "result": "passed"
      },
      {
        "clause_id": "standard.border.border-color.6eeb36a193a0",